tweet_id,text,language,type,bookmark_count,favorite_count,retweet_count,reply_count,view_count,created_at,client,hashtags,urls,media_type,media_urls
'1986514377470845007,"I would like to clarify a few things.  First, the obvious one: we do not have or want government guarantees for OpenAI datacenters. We believe that governments should not pick winners or losers, and that taxpayers should not bail out companies that make bad business decisions or otherwise lose in the market.  If one company fails, other companies will do good work.  What we do think might make sense is governments building (and owning) their own AI infrastructure, but then the upside of that should flow to the government as well. We can imagine a world where governments decide to offtake a lot of computing power and get to decide how to use it, and it may make sense to provide lower cost of capital to do so. Building a strategic national reserve of computing power makes a lot of sense. But this should be for the government’s benefit, not the benefit of private companies.  The one area where we have discussed loan guarantees is as part of supporting the buildout of semiconductor fabs in the US, where we and other companies have responded to the government’s call and where we would be happy to help (though we did not formally apply). The basic idea there has been ensuring that the sourcing of the chip supply chain is as American as possible in order to bring jobs and industrialization back to the US, and to enhance the strategic position of the US with an independent supply chain, for the benefit of all American companies. This is of course different from governments guaranteeing private-benefit datacenter buildouts.  There are at least 3 “questions behind the question” here that are understandably causing concern.  First, “How is OpenAI going to pay for all this infrastructure it is signing up for?” We expect to end this year above $20 billion in annualized revenue run rate and grow to hundreds of billion by 2030. We are looking at commitments of about $1.4 trillion over the next 8 years. Obviously this requires continued revenue growth, and each doubling is a lot of work! But we are feeling good about our prospects there; we are quite excited about our upcoming enterprise offering for example, and there are categories like new consumer devices and robotics that we also expect to be very significant. But there are also new categories we have a hard time putting specifics on like AI that can do scientific discovery, which we will touch on later.  We are also looking at ways to more directly sell compute capacity to other companies (and people); we are pretty sure the world is going to need a lot of “AI cloud”, and we are excited to offer this. We may also raise more equity or debt capital in the future. But everything we currently see suggests that the world is going to need a great deal more computing power than what we are already planning for.  Second, “Is OpenAI trying to become too big to fail, and should the government pick winners and losers?” Our answer on this is an unequivocal no. If we screw up and can’t fix it, we should fail, and other companies will continue on doing good work and servicing customers. That’s how capitalism works and the ecosystem and economy would be fine.  We plan to be a wildly successful company, but if we get it wrong, that’s on us.  Our CFO talked about government financing yesterday, and then later clarified her point underscoring that she could have phrased things more clearly. As mentioned above, we think that the US government should have a national strategy for its own AI infrastructure.  Tyler Cowen asked me a few weeks ago about the federal government becoming the insurer of last resort for AI, in the sense of risks (like nuclear power) not about overbuild. I said “I do think the government ends up as the insurer of last resort, but I think I mean that in a different way than you mean that, and I don’t expect them to actually be writing the policies in the way that maybe they do for nuclear”. Again, this was in a totally different context than datacenter buildout, and not about bailing out a company. What we were talking about is something going catastrophically wrong—say, a rogue actor using an AI to coordinate a large-scale cyberattack that disrupts critical infrastructure—and how intentional misuse of AI could cause harm at a scale that only the government could deal with. I do not think the government should be writing insurance policies for AI companies.  Third, “Why do you need to spend so much now, instead of growing more slowly?”. We are trying to build the infrastructure for a future economy powered by AI, and given everything we see on the horizon in our research program, this is the time to invest to be really scaling up our technology. Massive infrastructure projects take quite awhile to build, so we have to start now.  Based on the trends we are seeing of how people are using AI and how much of it they would like to use, we believe the risk to OpenAI of not having enough computing power is more significant and more likely than the risk of having too much. Even today, we and others have to rate limit our products and not offer new features and models because we face such a severe compute constraint.  In a world where AI can make important scientific breakthroughs but at the cost of tremendous amounts of computing power, we want to be ready to meet that moment. And we no longer think it’s in the distant future. Our mission requires us to do what we can to not wait many more years to apply AI to hard problems, like contributing to curing deadly diseases, and to bring the benefits of AGI to people as soon as possible.  Also, we want a world of abundant and cheap AI. We expect massive demand for this technology, and for it to improve people’s lives in many ways.  It is a great privilege to get to be in the arena, and to have the conviction to take a run at building infrastructure at such scale for something so important. This is the bet we are making, and given our vantage point, we feel good about it. But we of course could be wrong, and the market—not the government—will deal with it if we are.",,Tweet,,7981179,1425,5674,,2025-11-06 19:21:00,,,,,
'1986204243997688184,"A thing often in common among great startup investors, founders, and researchers:  Trading making a lot of small mistakes in exchange for getting a few giant wins.  (Surprisingly many people seem to prefer a few big mistakes in exchange for a lot of small wins.)",,Tweet,,1138456,587,1226,,2025-11-05 22:49:00,,,,,
'1985841697067319510,interesting post from @boazbaraktcs:  https://windowsontheory.org/2025/11/04/thoughts-by-a-non-economist-on-ai-and-economics/,,Tweet,,696976,186,292,,2025-11-04 22:48:00,,,,,
'1985814135784042993,Codex has transformed how OpenAI builds over the last few months. Have some great upcoming models too.  Amazing work by the team!,,Tweet,,1178184,324,906,,2025-11-04 20:59:00,,,,,
'1985431030430646365,Very pleased to be working with Amazon to bring a lot more NVIDIA chips online for OpenAI to keep scaling!,,Tweet,,1788403,715,1715,,2025-11-03 19:36:00,,,,,
'1985066412470325339,"you also wanted tesla to take openai over, no nonprofit at all.  and you said we had a 0% of success.  now you have a great AI company and so do we.  can't we all just move on?",,Tweet,,1264405,270,1036,,2025-11-02 19:28:00,,,,,
'1985066410859692333,i helped turn the thing you left for dead into what should be the largest non-profit ever.  you know as well as anyone a structure like what openai has now is required to make that happen.,,Quote,,6300982,874,2826,,2025-11-02 19:28:00,,,,,
'1984025727763935585,"GPT-6 will be renamed GPT-6-7, you're welcome",,Tweet,,14089828,2100,4091,,2025-10-30 22:32:00,,,,,
'1984025356597330061,little brother energy is the WORST,,Reply,,1023715,58,142,,2025-10-30 22:31:00,,,,,
'1984023891879346592,I really was excited for the car! And I understand delays. But 7.5 years has felt like a long time to wait.,,Tweet,,2089925,346,614,,2025-10-30 22:25:00,,,,,
'1984023663642087831,A tale in three acts:,,Tweet,,16532398,1820,2454,,2025-10-30 22:24:00,,,,photo,https://pbs.twimg.com/media/G4iqnaBa8AE-tr8.jpg|https://pbs.twimg.com/media/G4iqoyRawAAzu50.jpg|https://pbs.twimg.com/media/G4iqpmDa8AIKOe1.jpg
'1984003859086504446,ok i will try to do more silly philosophy tweets for you.  if i weren't worried about my kids safety you would get nonstop cute baby photos!,,Reply,,43319,24,72,,2025-10-30 21:05:00,,,,,
'1984002816315421032,i would like us to yeah! i think that would be cool.,,Reply,,45551,15,41,,2025-10-30 21:01:00,,,,,
'1984002552158154905,A new security agent called Aardvark:,,Quote,,861726,352,342,,2025-10-30 21:00:00,,,,,
'1984001525556097507,All palaces are temporary palaces  All theories are provisional theories,,Tweet,,632970,385,946,,2025-10-30 20:56:00,,,,,
'1983998115603734843,"If you want to use more Codex after you hit your subscription limits, you can now buy credits as needed.  This is something we expect to do for compute-intensive features; it will let us keep subscription prices low for most users and let the rest of you go wild.",,Quote,,665085,175,330,,2025-10-30 20:43:00,,,,,
'1983941806393024762,"if i were like, a sports star or an artist or something, and just really cared about doing a great job at my thing, and was up at 5 am practicing free throws or whatever, that would seem pretty normal right?  the first part of openai was unbelievably fun; we did what i believe is the most important scientific work of this generation or possibly a much greater time period than that.  this current part is less fun but still rewarding. it is extremely painful as you say and often tempting to nope out on any given day, but the chance to really ""make a dent in the universe"" is more than worth it; most people don't get that chance to such an extent, and i am very grateful. i genuinely believe the work we are doing will be a transformatively positive thing, and if we didn't exist, the world would have gone in a slightly different and probably worse direction.  (working hard was always an extremely easy trade until i had a kid, and now an extremely hard trade.)   i do wish i had taken equity a long time ago and i think it would have led to far fewer conspiracy theories; people seem very able to understand ""ok that dude is doing it because he wants more money"" but less so ""he just thinks technology is cool and he likes having some ability to influence the evolution of technology and society"". it was a crazy tone-deaf thing to try to make the point ""i already have enough money"".  i believe that AGI will be the most important technology humanity has yet built, i am very grateful to get to play an important role in that and work with such great colleagues, and i like having an interesting life.",,Reply,,1947237,807,962,,2025-10-30 16:59:00,,,,,
'1983910416288809046,I love the way Tibo and team are so methodically going through every inch of the system to try to track down user feedback.,,Quote,,591378,81,354,,2025-10-30 14:54:00,,,,,
'1983584367613243717,Link here: https://inv.kareem.one/ngDCxlZcecw,,Tweet,,471592,53,57,,2025-10-29 17:19:00,,,,,
'1983584366547829073,"Yesterday we did a livestream. TL;DR:  We have set internal goals of having an automated AI research intern by September of 2026 running on hundreds of thousands of GPUs, and a true automated AI researcher by March of 2028. We may totally fail at this goal, but given the extraordinary potential impacts we think it is in the public interest to be transparent about this.  We have a safety strategy that relies on 5 layers: Value alignment, Goal alignment, Reliability, Adversarial robustness, and System safety. Chain-of-thought faithfulness is a tool we are particularly excited about, but it somewhat fragile and requires drawing a boundary and a clear abstraction.  On the product side, we are trying to move towards a true platform, where people and companies building on top of our offerings will capture most of the value. Today people can build on our API and apps in ChatGPT; eventually, we want to offer an AI cloud that enables huge businesses.  We have currently committed to about 30 gigawatts of compute, with a total cost of ownership over the years of about $1.4 trillion. We are comfortable with this given what we see on the horizon for model capability growth and revenue growth. We would like to do more—we would like to build an AI factory that can make 1 gigawatt per week of new capacity, at a greatly reduced cost relative to today—but that will require more confidence in future models, revenue, and technological/financial innovation.  Our new structure is much simpler than our old one. We have a non-profit called OpenAI Foundation that governs a Public Benefit Corporation called OpenAI Group. The foundation initially owns 26% of the PBC, but it can increase with warrants over time if the PBC does super well. The PBC can attract the resources needed to achieve the mission.  Our mission, for both our non-profit and PBC, remains the same: to ensure that artificial general intelligence benefits all of humanity.  The nonprofit is initially committing $25 billion to health and curing disease, and AI resilience (all of the things that could help society have a successful transition to a post-AGI world, including technical safety but also things like economic impact, cyber security, and much more). The nonprofit now has the ability to actually deploy capital relatively quickly, unlike before.  In 2026 we expect that our AI systems may be able to make small new discoveries; in 2028 we could be looking at big ones. This is a really big deal; we think that science, and the institutions that let us widely distribute the fruits of science, are the most important ways that quality of life improves over time.",,Tweet,,5276746,525,971,,2025-10-29 17:19:00,,,,,
'1983223056668746218,"California is my home, and I love it here, and when I talked to Attorney General Bonta two weeks ago I made clear that we were not going to do what those other companies do and threaten to leave if sued.  We really wanted to figure this out and are really happy about where it all landed — and very much appreciate the work of the Attorney General!",,Tweet,,1606295,213,774,,2025-10-28 17:23:00,,,,,
'1983182740666364113,"Jakub and I are going to do a livestream and answer questions today at 10:30 am pacific.  We have a lot of things to talk about--of course we will cover our new corporate structure, but we will also discuss our new goals for research, the evolution of our product offerings, an update on our infrastructure buildout, the initial funding areas for the nonprofit, and more.  It is probably the most important stuff we have to say this year.  TL;DR on the structure--the non-profit remains in control and, if we do our jobs well, will be the best-resourced non-profit ever. We are excited to get to work immediately deploying the capital. Our LLC becomes a PBC.  I am grateful to the Delaware and California AGs, our partners at Microsoft, all our investors, and especially to our tireless team for their work in getting to a good place here.",,Tweet,,953832,245,696,,2025-10-28 14:43:00,,,,,
'1981758298635571477,ok gl,,Quote,,4241875,871,2100,,2025-10-24 16:22:00,,,,,
'1981494592987156899,Ari and team are super talented and we can't wait Sky x ChatGPT!,,Quote,,1647161,231,959,,2025-10-23 22:55:00,,,,,
'1980690768391201180,"Our new AI-first web browser, ChatGPT Atlas, is here for macOS.  Please send feedback! Availability on other platforms to follow.",,Tweet,,2948477,1555,3234,,2025-10-21 17:40:00,,,,,
'1980653675665322109,10 am livestream today to launch a new product I'm quite excited about!,,Quote,,2153483,710,1315,,2025-10-21 15:13:00,,,,,
'1978539332215681076,"Ok this tweet about upcoming changes to ChatGPT blew up on the erotica point much more than I thought it was going to! It was meant to be just one example of us allowing more user freedom for adults. Here is an effort to better communicate it:  As we have said earlier, we are making a decision to prioritize safety over privacy and freedom for teenagers. And we are not loosening any policies related to mental health. This is a new and powerful technology, and we believe minors need significant protection.  We also care very much about the principle of treating adult users like adults. As AI becomes more important in people's lives, allowing a lot of freedom for people to use AI in the ways that they want is an important part of our mission.  It doesn't apply across the board of course: for example, we will still not allow things that cause harm to others, and we will treat users who are having mental health crises very different from users who are not. Without being paternalistic we will attempt to help users achieve their long-term goals.  But we are not the elected moral police of the world. In the same way that society differentiates other appropriate boundaries (R-rated movies, for example) we want to do a similar thing here.",,Quote,,1990316,501,1802,,2025-10-15 19:11:00,,,,,
'1978300655069450611,Things have come a long way since the delivery of the DGX-1 9 years ago; amazing to see...,,Quote,,963771,273,450,,2025-10-15 03:23:00,,,,,
'1978143827144700214,we understand this and its what we are mostly focused on addressing!  promise you some people really want a 4o-style personality though...,,Reply,,193306,54,290,,2025-10-14 17:00:00,,,,,
'1978143301648736530,You won't get it unless you ask for it.,,Reply,,778344,35,229,,2025-10-14 16:58:00,,,,,
'1978143114565980528,"For sure; we want that too.  Almost all users can use ChatGPT. however they'd like without negative effects; for a very small percentage of users in mentally fragile states there can be serious problems.  0.1% of a billion users is still a million people.  We needed (and will continue to need) to learn how to protect those users, and then with enhanced tools for that, adults that are not at risk of serious harm (mental health breakdowns, suicide, etc) should have a great deal of freedom in how they use ChatGPT.",,Reply,,633626,81,237,,2025-10-14 16:57:00,,,,,
'1978131137928053011,i think both are cool,,Reply,,389126,87,186,,2025-10-14 16:09:00,,,,,
'1978129344598827128,"We made ChatGPT pretty restrictive to make sure we were being careful with mental health issues. We realize this made it less useful/enjoyable to many users who had no mental health problems, but given the seriousness of the issue we wanted to get this right.  Now that we have been able to mitigate the serious mental health issues and have new tools, we are going to be able to safely relax the restrictions in most cases.  In a few weeks, we plan to put out a new version of ChatGPT that allows people to have a personality that behaves more like what people liked about 4o (we hope it will be better!). If you want your ChatGPT to respond in a very human-like way, or use a ton of emoji, or act like a friend, ChatGPT should do it (but only if you want it, not because we are usage-maxxing).  In December, as we roll out age-gating more fully and as part of our “treat adult users like adults” principle, we will allow even more, like erotica for verified adults.",,Tweet,,19413935,2896,6257,,2025-10-14 16:02:00,,,,,
'1977177505971736675,"Codex is so good, and is going to get so amazing.  I am having a hard time imagining what creating software at the end of 2026 is going to look like.",,Tweet,,2247279,772,1663,,2025-10-12 01:00:00,,,,,
'1976799538523292027,"One of the most fun parts of OpenAI is watching people here level up so fast and do such excellent work.  We are operating at a high level across many different disciplines and many of the people doing it have never done it before, and joined us at the beginning of their career.  If you believe in people and give them a lot of responsibility and support (and pick the right people to bet on) you will be surprised on the upside more often than you think.  I would love to see more companies operate this way and think we would all benefit.  (This was also one of the most fun parts of startup investing.)",,Tweet,,1380057,631,1243,,2025-10-10 23:58:00,,,,,
'1976477108374470906,me either,,Reply,,1291783,28,364,,2025-10-10 02:37:00,,,,,
'1975185516225278428,Excited to partner with AMD to use their chips to serve our users!  This is all incremental to our work with NVIDIA (and we plan to increase our NVIDIA purchasing over time).  The world needs much more compute...,,Tweet,,2857742,1229,1777,,2025-10-06 13:04:00,,,,,
'1974980036454416391,excited for dev day tomorrow!  got some new stuff to help you build with AI.,,Tweet,,1485445,603,1457,,2025-10-05 23:28:00,,,,,
'1974272833875329113,Sora update #1:  https://blog.samaltman.com/sora-update-number-1,,Tweet,,2403876,569,1093,,2025-10-04 00:38:00,,1,,,
'1973381552621887706,"i get the vibe here, but...  we do mostly need the capital for build AI that can do science, and for sure we are focused on AGI with almost all of our research effort.  it is also nice to show people cool new tech/products along the way, make them smile, and hopefully make some money given all that compute need.  when we launched chatgpt there was a lot of ""who needs this and where is AGI"".  reality is nuanced when it comes to optimal trajectories for a company.",,Quote,,3076990,488,1648,,2025-10-01 13:36:00,,,,,
'1973377760262295959,it is way less strange to watch a feed full of memes of yourself than i thought it would be.  not sure what to make of this.,,Tweet,,1241108,407,1547,,2025-10-01 13:21:00,,,,,
'1973222034680447283,"my reaction was ""let's do a product""",,Reply,,76279,17,80,,2025-10-01 03:02:00,,,,,
'1973216690516426982,does feel like this is really starting to happen (in tiny ways),,Quote,,854063,161,472,,2025-10-01 02:41:00,,,,,
'1973215799042252812,amazing breakthroughs from @model_mechanic again and again and i have no doubt the best ones are coming soon :),,Quote,,497778,102,208,,2025-10-01 02:38:00,,,,,
'1973080473896189959,lol gj gabriel,,Quote,,563433,132,353,,2025-09-30 17:40:00,,,,,
'1973078555274743883,thanks bill for your leadership and vision on this project; it has been awesome to watch.,,Quote,,713813,77,196,,2025-09-30 17:32:00,,,,,
'1973074276765835657,"congrats, liam!",,Quote,,498519,85,128,,2025-09-30 17:15:00,,,,,
'1973074066111148510,(or here with nicer formatting: https://blog.samaltman.com/sora-2),,Tweet,,238550,77,71,,2025-09-30 17:14:00,,,,,
