tweet_id,text,language,type,bookmark_count,favorite_count,retweet_count,reply_count,view_count,created_at,client,hashtags,urls,media_type,media_urls
'2049236104457650435,that does feel like it would be a good thing to do at some point,,Reply,,47157,5,29,,2026-04-28 21:15:00,,,,,
'2049235921510506556,if you buy a pro subscription then yes,,Reply,,68458,8,60,,2026-04-28 21:14:00,,,,,
'2049235442307125671,THIS IS A GOOD IDEA,,Reply,,67321,6,41,,2026-04-28 21:12:00,,,,,
'2048193105711837522,i did somehow think id be more grown up by now,,Reply,,262828,52,193,,2026-04-26 00:11:00,,,,,
'2048192856087789754,it has been fun but ok i'll disconnect it,,Reply,,75832,2,39,,2026-04-26 00:10:00,,,,,
'2048167247278207182,💀,,Reply,,145497,10,35,,2026-04-25 22:28:00,,,,,
'2048161260601262082,"wow that looks good  maybe it is time to bonesmash, or at least tanning peptides.",,Reply,,166105,21,74,,2026-04-25 22:04:00,,,,,
'2048160448340767038,(and we will fix the former),,Tweet,,363059,23,105,,2026-04-25 22:01:00,,,,,
'2048160404376105179,we still get looksmaxxed on frontend a little but we IQmog hard now,,Tweet,,3424853,807,1488,,2026-04-25 22:01:00,,,,,
'2048062261584077149,"5.5 is so earnest  ""little engine that could"" energy",,Tweet,,367336,129,625,,2026-04-25 15:31:00,,,,,
'2048061746385166552,cold take,,Reply,,144739,48,136,,2026-04-25 15:29:00,,,,,
'2047824611791024406,"ok fine thats close enough, send address i send xwing",,Reply,,366359,8,30,,2026-04-24 23:46:00,,,,,
'2047824397923393838,too soon!,,Reply,,33900,2,22,,2026-04-24 23:45:00,,,,,
'2047823357635354814,this was a good week.  proud of the team.  happy building!,,Tweet,,404224,207,594,,2026-04-24 23:41:00,,,,,
'2047787124846653895,GPT-5.5 and GPT-5.5 Pro are now available in the API!,,Tweet,,405427,297,551,,2026-04-24 21:17:00,,,,,
'2047683787828703289,🫶,,Quote,,307857,51,306,,2026-04-24 14:27:00,,,,,
'2047496898584719629,what about 5.5?,,Reply,,375099,13,204,,2026-04-24 02:04:00,,,,,
'2047414363053777282,please tell me imagegen,,Reply,,222479,23,106,,2026-04-23 20:36:00,,,,,
'2047403771416940715,"""don't retweet this, don't retweet this, don't retweet this...""  ah fuck it, life imitates art.",,Quote,,910172,250,358,,2026-04-23 19:54:00,,,,,
'2047395562501411058,We tried a new thing with NVIDIA to roll out Codex across a whole company and it was awesome to see it work.  Let us know if you'd like to do it at your company!,,Tweet,,1061203,415,477,,2026-04-23 19:21:00,,,,photo,https://pbs.twimg.com/media/HGnO_TCbwAEBSHl.jpg
'2047392357482639749,embers,,Quote,,238231,32,131,,2026-04-23 19:09:00,,,,,
'2047386286613283180,important (and very jakub-coded) jakub quote:,,Quote,,254547,50,100,,2026-04-23 18:45:00,,,,,
'2047386068194852963,"Really excellent work by the inference team to serve this model so efficiently!  To a significant degree, we have to become an AI inference company now.",,Tweet,,326813,149,271,,2026-04-23 18:44:00,,,,,
'2047384856192028870,join the light side and i'll send you a lego x-wing,,Reply,,65379,7,75,,2026-04-23 18:39:00,,,,,
'2047379615589777666,"1. We believe in iterative deployment; although GPT-5.5 is already a smart model, we expect rapid improvements. Iterative deployment is a big part of our safety strategy; we believe the world will be best equipped to win at the team sport of AI resilience this way.  2. We believe in democratization. We want people to be able to use lots of AI; we aim to have the most efficient models, the most efficient inference stack, and the most compute. We want our users to have access to the best technology and for everyone to have equal opportunity. We have been tracking cybersecurity as a preparedness category for a long time, and have built mitigations we believe in that enable us to make capable models broadly available.  3. We love you and we want you to win. We want to be a platform for every company, scientist, entrepreneur, and person. (My whole career has largely been about the magic of startups, and I think we are about to see that magic at hyperscale.)",,Tweet,,551861,494,718,,2026-04-23 18:18:00,,,,,
'2047379036419014928,"API pricing will be $5 per 1 million input tokens and $30 per 1 million output tokens, with a 1 million context window.  (Remember, you will need less tokens per task than 5.4!)",,Tweet,,247296,49,114,,2026-04-23 18:16:00,,,,,
'2047378431260664058,"Also, a ton of new Codex features coming soon! Fun little bundle w/the new model.",,Tweet,,214013,164,327,,2026-04-23 18:13:00,,,,,
'2047378254575685707,"It is smart and fast; per-token speed matches 5.4 and it uses significantly fewer tokens per task.  In my experience, it ""gets what to do"".  Rolling out today in ChatGPT and Codex. We are working with API customers on security and safeguards and plan to launch in API very soon.",,Tweet,,266778,70,109,,2026-04-23 18:13:00,,,,,
'2047378253313106112,GPT-5.5 is here! We hope it's useful to you. I personally like it.,,Tweet,,1697890,948,1578,,2026-04-23 18:13:00,,,,,
'2047375843089863056,this was such a weird side-plot,,Reply,,47146,10,62,,2026-04-23 18:03:00,,,,,
'2047349336263012771,Images 2.0 really got over some important qualitative threshold for me that I didn't know existed.,,Tweet,,300628,134,552,,2026-04-23 16:18:00,,,,,
'2047348141091922361,cmon dude  at least a case would be fair,,Reply,,40922,5,29,,2026-04-23 16:13:00,,,,,
'2047347674743963705,"we love seeing our users win.  we want to give you the best tools, lots of compute, and watch you do the magic.",,Tweet,,657271,496,1424,,2026-04-23 16:11:00,,,,,
'2047017964105597009,These are cool! I think most companies will want to use them.,,Quote,,1102190,205,427,,2026-04-22 18:21:00,,,,,
'2046809014751883483,we gotchu,,Reply,,180736,61,123,,2026-04-22 04:31:00,,,,,
'2046808900301975576,change urs it sucks,,Reply,,94499,28,105,,2026-04-22 04:30:00,,,,,
'2046808785042477518,easily,,Reply,,42046,3,17,,2026-04-22 04:30:00,,,,,
'2046808596969853103,how about a rate limit reset in a week or so?,,Reply,,142586,17,75,,2026-04-22 04:29:00,,,,,
'2046808217133670800,tongiht i have had a couple of drinks,,Quote,,1220611,119,227,,2026-04-22 04:28:00,,,,,
'2046808114561974567,ok boomer,,Reply,,6055447,371,581,,2026-04-22 04:27:00,,,,,
'2046798393918505024,🫡,,Reply,,403059,61,48,,2026-04-22 03:48:00,,,,,
'2046798302990205365,it sounds like it,,Reply,,32625,4,15,,2026-04-22 03:48:00,,,,,
'2046764594505592884,come to the light side,,Reply,,310469,94,199,,2026-04-22 01:34:00,,,,,
'2046752492093165708,We want you to have a lot of AI!,,Quote,,761633,170,568,,2026-04-22 00:46:00,,,,,
'2046682384251429279,"Gabe is incredibly talented and a great leader. Happy to see this, but not surprised.",,Quote,,779787,48,186,,2026-04-21 20:08:00,,,,,
'2046679643064000880,this is sorta how i imagine it happens,,Reply,,64599,10,58,,2026-04-21 19:57:00,,,,,
'2046672912833458597,Here is a manga made by ChatGPT Images 2.0 of @gabeeegoooh and me looking for more GPUs:,,Tweet,,536070,214,563,,2026-04-21 19:30:00,,,,photo,https://pbs.twimg.com/media/HGc9v8TbkAA-9kN.jpg|https://pbs.twimg.com/media/HGc-DOkb0AAY2rk.jpg|https://pbs.twimg.com/media/HGc-FVraYAAcTcH.jpg
'2046604989527912590,"Codex hit 4M active users, less than two weeks after hitting 3M.  We will reset rate limits today!",,Tweet,,1531498,979,1458,,2026-04-21 15:00:00,,,,,
'2046598595869331894,"Really excited for this week!  Next up, we've got something to show you at 12 pm PT today.",,Quote,,1390556,501,853,,2026-04-21 14:35:00,,,,,
'2046330825265086712,Tim Cook is a legend.  I am very thankful for everything he has done and I am very thankful for Apple.,,Tweet,,2251098,1843,1522,,2026-04-20 20:51:00,,,,,
'2046330082726384051,"The internal working name for this was ""telepathy"", and it feels like it.",,Quote,,696668,121,312,,2026-04-20 20:48:00,,,,,
'2045232470917022162,"really going to miss you, bill! your creativity pushed openai and the world to experience ai video in new ways. excited to see what you do next.",,Reply,,194152,20,99,,2026-04-17 20:06:00,,,,,
'2044921348540264614,"I am happy everyone is switching to Codex, but Tibo if you start rate limiting me or making me use worse models...",,Quote,,2056012,311,945,,2026-04-16 23:30:00,,,,,
'2044858863246323811,"Codex can learn from experience and proactively suggest things it can do for you.  It now has an in-app browser, many new plugins, and so much more.",,Tweet,,147415,24,105,,2026-04-16 19:21:00,,,,,
'2044858862042591378,"Lots of major improvements to Codex!  Computer use is a real update for me; it feels even more useful than I expected. It can use all of the apps on your Mac, in parallel and without interfering with your direct work.",,Tweet,,842708,455,996,,2026-04-16 19:21:00,,,,,
'2042789312400363702,That was a bad word choice and i wish i hadn't used it.  It has been a tough day and I am not thinking the most clearly that I ever have.,,Reply,,334115,26,258,,2026-04-11 02:18:00,,,,,
'2042738954550603884,"I wrote this early this morning and I wasn't sure if I would actually publish it, but here it is:  https://blog.samaltman.com/2279512",,Tweet,,7078258,1211,2790,,2026-04-10 22:58:00,,,,,
'2042342572958630332,It is very nice to see Codex getting so much love. We are launching a $100 ChatGPT Pro tier by very popular demand.,,Tweet,,1099215,406,1613,,2026-04-09 20:43:00,,,,,
'2041658719839383945,"To celebrate 3 million weekly codex users, we are resetting usage limits.  We will do this every million users up to 10 million.  Happy building!",,Tweet,,2066490,1254,1839,,2026-04-07 23:25:00,,,,,
'2039775053450289409,"We can offer you a free chatgpt pro account, two openai tshirts of your choice, and you have to have max and me on the show together to discuss what went wrong in your weighlifting career.",,Reply,,638829,46,266,,2026-04-02 18:40:00,,,,,
'2039773740586918137,"TBPN is my favorite tech show.  We want them to keep that going and for them to do what they do so well.  I don't expect them to go any easier on us, am sure I'll do my part to help enable that with occasional stupid decisions.",,Tweet,,1098029,196,962,,2026-04-02 18:35:00,,,,,
'2038640963036626971,This is a very good post:,,Quote,,544928,179,671,,2026-03-30 15:34:00,,,,,
'2037610000122839116,The first steel beams went up this week at our Michigan Stargate site with Oracle and Related Digital,,Tweet,,1325838,387,1228,,2026-03-27 19:17:00,,,,,
'2037396826060673188,"The coolest meeting I had this week with was Paul, who used ChatGPT and other LLMs to create an mRNA vaccine protocol to save his dog Rosie. It is amazing story.  ""The chat bots empowered me as an individual to act with the power of a research institute - planning, education, troubleshooting, compliance, and yes, real scientific design work in converting genomic data to a vaccine prescription and designing the treatment protocol around it. But they worked alongside humans at every step. The combination is what made it possible.""  It immediately got me thinking ""this should be a company"".  Also, Paul is an extraordinary guy. This should be easy to do, but it is not yet.",,Quote,,1710145,476,1121,,2026-03-27 05:10:00,,,/i/article/2036940410363535823,,
'2036489823792607273,"I would like a single word for this phrase: ""throw it into the maw with every bit of context I can think of"".",,Quote,,799439,123,1061,,2026-03-24 17:06:00,,,,,
'2036488729230295399,More details here:  https://openaifoundation.org/news/update-on-the-openai-foundation,,Tweet,,169991,40,88,,2026-03-24 17:02:00,,,,,
'2036488680769241223,"AI will help discover new science, such as cures for diseases, which is perhaps the most important way to increase quality of life long-term.  AI will also present new threats to society that we have to address. No company can sufficiently mitigate these on their own; we will need a society-wide response to things like novel bio threats, a massive and fast change to the economy, extremely capable models causing complex emergent effects across society, and more.  These are the areas the OpenAI Foundation will initially focus on, and in my opinion are some of the most important ones for us to get right. The Foundation will spend at least $1 billion over the next year.  @woj_zaremba, co-founder of OpenAI, will transition to Head of AI Resilience. I believe that shifting how the world thinks about safety to include a Resilience-style approach is critical, and I am extremely grateful to Wojciech for taking on this role.  Wojciech has been my cofounder for the last decade; anyone who knows him will understand what I mean when I say he is one of a kind. He has a lot of ideas about how we build a new kind of AI safety.  @JacobTref is joining as Head of Life Sciences and Curing Diseases.  @annaadeola, our VP of Global Impact, will transition to Head of AI for Civil Society and Philanthropy.  @robert_kaiden is joining as Chief Financial Officer.  @jeffarnold is joining as Director of Operations.",,Tweet,,1047239,538,1725,,2026-03-24 17:01:00,,,,,
'2036137695605563682,"I have loved being on the Helion board; I continue to be extremely excited about a future with abundant energy and Helion in particular.  As Helion and OpenAI start to explore working together at significant scale, it is difficult for me to be on both boards. (I will have a financial interest in Helion so still be recused from negotiations, but from a governance perspective this will make things easier for both companies.)  David and Chris are exceptional founders and I think people will be quite impressed by the company's progress.",,Quote,,807784,137,594,,2026-03-23 17:47:00,,,,,
'2033960476972093566,"We are not shutting it down, quite the opposite!  I think you will love what the team is building.",,Reply,,402929,51,310,,2026-03-17 17:35:00,,,,,
'2033935276079510011,I have so much gratitude to people who wrote extremely complex software character-by-character. It already feels difficult to remember how much effort it really took.  Thank you for getting us to this point.,,Tweet,,5683831,2143,4541,,2026-03-17 15:55:00,,,,,
'2033660522961502288,"It is also very smart, but...I generally agree with this, and really feel it myself on the 5.3 -> 5.4 upgrade.",,Quote,,873939,98,709,,2026-03-16 21:43:00,,,,,
'2033659889843913000,Great first week for 5.4 in the API.  Builders building fast.,,Quote,,448432,135,400,,2026-03-16 21:41:00,,,,,
'2033599375256207820,The Codex team are hardcore builders and it really comes through in what they create. No surprise all the hardcore builders I know have switched to Codex.  Usage of Codex is growing very fast:,,Tweet,,862714,297,1249,,2026-03-16 17:40:00,,,,photo,https://pbs.twimg.com/media/HDjLsPxbEAAnqGl.png
'2030319489993298349,"GPT-5.4 is great at coding, knowledge work, computer use, etc, and it's nice to see how much people are enjoying it.  But it's also my favorite model to talk to! We have missed the mark on model personality for awhile, so it feels extra good to be moving in the right direction.",,Tweet,,1177241,579,2836,,2026-03-07 16:27:00,,,,,
'2030318958512164966,Very grateful to Jensen for working to expand Nvidia capacity at AWS so much for us!,,Quote,,642662,175,353,,2026-03-07 16:25:00,,,,,
'2030318632899953108,Wow real range of emotion reading the second and then the the third paragraph.,,Quote,,712813,71,438,,2026-03-07 16:24:00,,,,,
'2030318481653334067,"""What is the hardest question I could ask you that you might get right?""",,Quote,,1627378,202,1154,,2026-03-07 16:23:00,,,,,
'2030318213482131670,"GPT-5.4 is really good at spreadsheets; a few finance people have finally said things to me like ""huh I guess this AI thing is real""",,Quote,,1033956,215,556,,2026-03-07 16:22:00,,,,,
'2029627696314208257,We will be able to fix these three things!,,Quote,,960706,154,701,,2026-03-05 18:38:00,,,,,
'2029623948980416681,Forgot to mention /fast!  I think people will like this.,,Quote,,417608,154,683,,2026-03-05 18:23:00,,,,,
'2029623487007183274,Codex app on Windows!,,Quote,,323432,173,335,,2026-03-05 18:22:00,,,,,
'2029622732594499630,"GPT-5.4 is launching, available now in the API and Codex and rolling out over the course of the day in ChatGPT.  It's much better at knowledge work and web search, and it has native computer use capabilities.  You can steer it mid-response, and it supports 1m tokens of context.",,Tweet,,1334820,1160,1943,,2026-03-05 18:19:00,,,,photo,https://pbs.twimg.com/media/HCqqLFAaUAQ43Cd.jpg
'2028642231138353299,"(I also would like to share this, which I wrote after thinking a little more.)  There is a lot we will talk about in the coming days, but since this is one of the first ""real deal"" decisions we have faced, I wanted to share a few things that have been heavily on my mind the past few days.  These are the principles I care most about for this decision: alignment, democratization, empowerment, and individual agency.  The democratic process must stay in control, and we must democratize AI. OpenAI should not decide the fate of the world; no private company should. We need to work with governments, but also we need to make sure individuals get increasing power.  Things are moving so fast that we need to urgently educate the world so that the democratic process has time to catch up. I think one of our most important strategic decisions ever was the principle of iterative deployment.  In particular, the key element required for democracy, such as protection of privacy, must be defended by all of society.  I believe that, as some of the creators of this new technology, we deserve to and are obligated to have a loud voice about the risks, pitfalls, and benefits we see.   I think we are heading towards a world where the relationship between governments and AI efforts is critical. This will be difficult but it has to happen; I do not see any good future where we don't get there. There should not be games and fights in the press like this; drastic government action should be avoided.  I think there are real dangers coming to the world, and maybe pretty soon; I tried to put myself in the mindset of how I'd feel the day after an attack on the US or a new bioweapon we could have helped prevent.",,Tweet,,570508,123,732,,2026-03-03 01:22:00,,,,,
'2028640354912923739,"Here is re-post of an internal post:  We have been working with the DoW to make some additions in our agreement to make our principles very clear.  1.   We are going to amend our deal to add this language, in addition to everything else:  ""• Consistent with applicable laws, including the Fourth Amendment to the United States Constitution, National Security Act of 1947, FISA Act of 1978, the AI system shall not be intentionally used for domestic surveillance of U.S. persons and nationals.  • For the avoidance of doubt, the Department understands this limitation to prohibit deliberate tracking, surveillance, or monitoring of U.S. persons or nationals, including through the procurement or use of commercially acquired personal or identifiable information.""  It’s critical to protect the civil liberties of Americans, and there was so much focus on this, that we wanted to make this point especially clear, including around commercially acquired information. Just like everything we do with iterative deployment, we will continue to learn and refine as we go.  I think this is an important change; our team and the DoW team did a great job working on it.  2. The Department also affirmed that our services will not be used by Department of War intelligence agencies (for example, the NSA). Any services to those agencies would require a follow-on modification to our contract.  3. For extreme clarity: we want to work through democratic processes. It should be the government making the key decisions about society. We want to have a voice, and a seat at the table where we can share our expertise, and to fight for principles of liberty. But we are clear on how the system works (because a lot of people have asked, if I received what I believed was an unconstitutional order, of course I would rather go to jail than follow it). But  4. There are many things the technology just isn’t ready for, and many areas we don’t yet understand the tradeoffs required for safety. We will work through these, slowly, with the DoW, with technical safeguards and other methods.  5. One thing I think I did wrong: we shouldn't have rushed to get this out on Friday. The issues are super complex, and demand clear communication. We were genuinely trying to de-escalate things and avoid a much worse outcome, but I think it just looked opportunistic and sloppy. Good learning experience for me as we face higher-stakes decisions in the future.  In my conversations over the weekend, I reiterated that Anthropic should not be designated as a SCR, and that we hope the DoW offers them the same terms we’ve agreed to.  We will host an All Hands tomorrow morning to answer more questions.",,Tweet,,3583314,612,3737,,2026-03-03 01:15:00,,,,,
'2027961896343900379,my kid's birthday dinner!,,Reply,,57802,4,67,,2026-03-01 04:19:00,,,,,
'2027961129209938058,"This is a more general point: if we have a loss of control with AGI, we are probably in a very bad place.  (I have heard some colleagues I really respect say that as long as it loves humanity, even if we 'lose control' we are probably ok. Maybe they are right, but I personally think it's really important humanity stays in control.)  This is one of the most important areas of long-term alignment research.",,Reply,,36238,6,28,,2026-03-01 04:16:00,,,,,
'2027960563285037540,"I don't know the details of what they received. If they received they same offer we did in the end, then yes I think they should have done it. But that feels like an obvious thing to say, and of course they can have a different stance.",,Reply,,26515,3,10,,2026-03-01 04:14:00,,,,,
'2027960031107551658,No.  Also you should update your apps.,,Reply,,73075,19,79,,2026-03-01 04:12:00,,,,,
'2027959937234833594,0%. I wish they still did. I would have had a better week!,,Reply,,21357,3,11,,2026-03-01 04:11:00,,,,,
'2027959788597072096,"Yes, this seems like a very good idea. I will talk to the team.",,Reply,,593961,3,12,,2026-03-01 04:11:00,,,,,
'2027959361654632733,,,Quote,,37999,3,16,,2026-03-01 04:09:00,,,,,
'2027958834741055691,"I have never known how to put an exact number on p(doom), to say nothing of how to think about the differential.  I will say this: if I thought going to work every day made it less likely that we all continue to thrive into the future, I would retire and just hang with my kids.",,Reply,,65213,6,39,,2026-03-01 04:07:00,,,,,
'2027958255331471505,"I value my liberty and safety, and yours. I believe that strong democracy, and a strong US in particular, is a very good thing for the world.  The 16 year old me thought every country should just abolish their defense department at the same time. I wish he were right, but I now thing the world is a much more fragile place.",,Reply,,101505,12,186,,2026-03-01 04:05:00,,,,,
'2027957684625150444,"Yes; I think it is an extremely scary precedent and I wish they handled it a different way. I don't think Anthropic handled it well either, but as the more powerful party, I hold the government more responsible.  I am still hopeful for a much better resolution.",,Reply,,113329,8,50,,2026-03-01 04:02:00,,,,,
'2027957178968248836,"We are not yet set up for it, but Azure is for what they do seperately with the government.  We don't yet know how long it will take us to get set up. My best guess is a small number of months.",,Reply,,25478,3,6,,2026-03-01 04:00:00,,,,,
'2027956853653811438,"I don't think this will happen. But of course if we are confident it's unconstitutional, we wouldn't follow it. The constitution is more important than any job, or staying out of jail, or whatever.  In my experience, the people in our military are far more committed to the constitution than an average person off the streets.   An important part of this is that I don't think our company is above the constitution either.",,Reply,,48716,6,53,,2026-03-01 03:59:00,,,,,
'2027924720558215542,I have to go do something for awhile but can answer more questions tonight.,,Tweet,,670716,26,288,,2026-03-01 01:51:00,,,,,
'2027922703337066787,"We deliver a system (including choosing what models to deploy), and they can use it bound by lawful ways, including laws and directives around autonomous weapons and surveillance. But we get to decide what system to build, and the DoW understands that there are lot of risks we deeply understand. We can, and will, build a lot of protections into that system, including for ensuring that the red lines are not crossed. The DoW is supportive of this approach.  We are generally quite comfortable with the laws of the US, but there are cases where the technology isn't very good, shouldn't be used, and would have serious unintended consequences.  We do not want the ability to opine on a specific (and legal) military action. But we do really want the ability to use our expertise to design a safe system.",,Reply,,196991,15,53,,2026-03-01 01:43:00,,,,,
